{"doi":"10.1051\/0004-6361:200400055","coreId":"66430","oai":"oai:dro.dur.ac.uk.OAI2:1507","identifiers":["oai:dro.dur.ac.uk.OAI2:1507","10.1051\/0004-6361:200400055"],"title":"Very high energy gamma rays from the direction of Sagittarius A*.","authors":["Aharonian,, F.","Akhperjanian, A. G.","Aye, K.-M.","Bazer-Bachi, A. R.","Beilicke, M.","Benbow, W.","Berge, D.","Berghaus, P.","Bernl\u00f6hr, K.","Bolz, O.","Boisson, C.","Borgmeier, C.","Breitling, F.","Brown, A. M.","Bussons Gordo, J.","Chadwick, P. M.","Chitnis, V. R.","Chounet, L.-M.","Cornils, R.","Costamante, L.","Degrange, B.","Djannati-Ata\u00ef, A. O'C.","Drury, L.","Ergin, T.","Espigat, P.","Feinstein, F.","Fleury, P.","Fontaine, G.","Funk, S.","Gallant, Y.","Giebels, B.","Gillessen, S.","Goret, P.","Guy, J.","Hadjichristidis, C.","Hauser, M.","Heinzelmann, G.","Henri, G.","Hermann, G.","Hinton, J. A.","Hofmann, W.","Holleran, M.","Horns, D.","de Jager, O. C.","Jung, I.","Kh\u00e9lifi, B.","Komin, N.","Konopelko, A.","Latham, I. J.","Le Gallou, R.","Lemoine, M.","Lemi\u00e8re, A.","Leroy, N.","Lohse, T.","Marcowith, A.","Masterson, C.","McComb, T. J. L.","de Naurois, M.","Nolan, S. J.","Noutsos, A.","Orford, K. J.","Osborne, J. L.","Ouchrif, M.","Panter, M.","Pelletier, G.","Pita, S.","Pohl, M.","P\u00fchlhofer, G.","Punch, M., M.","Raubenheimer, B. C.","Raue, M.","Raux, J.","Rayner, S. M.","Redondo, I.","Reimer, A,","Reimer, O.","Ripken, J.","Rivoal, M.","Rob, L.","Rolland, L.","Rowell, G.","Sahakian, V.","Saug\u00e9, L.","Schlenker, S.","Schlickeiser, R.","Schuster, C.","Schwanke, U.","Siewert, M.","Sol, H.","Steenkamp, R.","Stegmann, C.","Tavernet, J.-P.","Th\u00e9oret, C. G.","Tluczykont, M.","van der Walt, D. J.","Vasileiadis, G.","Vincent, P.","Visser, B.","V\u00f6lk, H. J.","Wagner, S. J."],"enrichments":{"references":[],"documentType":{"type":1}},"contributors":[],"datePublished":"2004-10-01","abstract":"We report the detection of a point-like source of very high energy (VHE) -rays coincident within  1' of Sgr A *, obtained with the HESS array of Cherenkov telescopes. The -rays exhibit a power-law energy spectrum with a spectral index of  and a flux above the 165 GeV threshold of  m -2 s -1. The measured flux and spectrum differ substantially from recent results reported in particular by the CANGAROO collaboration","downloadUrl":"https:\/\/core.ac.uk\/download\/pdf\/66430.pdf","fullTextIdentifier":"http:\/\/dro.dur.ac.uk\/1507\/1\/1507.pdf","pdfHashValue":"6cc339a303bc3f846e5b92300ac0486d9e3230e5","publisher":"EDP Sciences","rawRecordXml":"<record><header><identifier>\n  \n    \n      oai:dro.dur.ac.uk.OAI2:1507<\/identifier><datestamp>\n      2017-03-09T16:34:36Z<\/datestamp><\/header><metadata><oai_dc:dc xmlns:oai_dc=\"http:\/\/www.openarchives.org\/OAI\/2.0\/oai_dc\/\" xmlns:dc=\"http:\/\/purl.org\/dc\/elements\/1.1\/\" xmlns:xsi=\"http:\/\/www.w3.org\/2001\/XMLSchema-instance\" xsi:schemaLocation=\"http:\/\/www.openarchives.org\/OAI\/2.0\/oai_dc\/ http:\/\/www.openarchives.org\/OAI\/2.0\/oai_dc.xsd\" ><dc:title>\n    \n      \n        Very high energy gamma rays from the direction of Sagittarius A*.<\/dc:title><dc:creator>\n        Aharonian,, F.<\/dc:creator><dc:creator>\n        Akhperjanian, A. G.<\/dc:creator><dc:creator>\n        Aye, K.-M.<\/dc:creator><dc:creator>\n        Bazer-Bachi, A. R.<\/dc:creator><dc:creator>\n        Beilicke, M.<\/dc:creator><dc:creator>\n        Benbow, W.<\/dc:creator><dc:creator>\n        Berge, D.<\/dc:creator><dc:creator>\n        Berghaus, P.<\/dc:creator><dc:creator>\n        Bernl\u00f6hr, K.<\/dc:creator><dc:creator>\n        Bolz, O.<\/dc:creator><dc:creator>\n        Boisson, C.<\/dc:creator><dc:creator>\n        Borgmeier, C.<\/dc:creator><dc:creator>\n        Breitling, F.<\/dc:creator><dc:creator>\n        Brown, A. M.<\/dc:creator><dc:creator>\n        Bussons Gordo, J.<\/dc:creator><dc:creator>\n        Chadwick, P. M.<\/dc:creator><dc:creator>\n        Chitnis, V. R.<\/dc:creator><dc:creator>\n        Chounet, L.-M.<\/dc:creator><dc:creator>\n        Cornils, R.<\/dc:creator><dc:creator>\n        Costamante, L.<\/dc:creator><dc:creator>\n        Degrange, B.<\/dc:creator><dc:creator>\n        Djannati-Ata\u00ef, A. O'C.<\/dc:creator><dc:creator>\n        Drury, L.<\/dc:creator><dc:creator>\n        Ergin, T.<\/dc:creator><dc:creator>\n        Espigat, P.<\/dc:creator><dc:creator>\n        Feinstein, F.<\/dc:creator><dc:creator>\n        Fleury, P.<\/dc:creator><dc:creator>\n        Fontaine, G.<\/dc:creator><dc:creator>\n        Funk, S.<\/dc:creator><dc:creator>\n        Gallant, Y.<\/dc:creator><dc:creator>\n        Giebels, B.<\/dc:creator><dc:creator>\n        Gillessen, S.<\/dc:creator><dc:creator>\n        Goret, P.<\/dc:creator><dc:creator>\n        Guy, J.<\/dc:creator><dc:creator>\n        Hadjichristidis, C.<\/dc:creator><dc:creator>\n        Hauser, M.<\/dc:creator><dc:creator>\n        Heinzelmann, G.<\/dc:creator><dc:creator>\n        Henri, G.<\/dc:creator><dc:creator>\n        Hermann, G.<\/dc:creator><dc:creator>\n        Hinton, J. A.<\/dc:creator><dc:creator>\n        Hofmann, W.<\/dc:creator><dc:creator>\n        Holleran, M.<\/dc:creator><dc:creator>\n        Horns, D.<\/dc:creator><dc:creator>\n        de Jager, O. C.<\/dc:creator><dc:creator>\n        Jung, I.<\/dc:creator><dc:creator>\n        Kh\u00e9lifi, B.<\/dc:creator><dc:creator>\n        Komin, N.<\/dc:creator><dc:creator>\n        Konopelko, A.<\/dc:creator><dc:creator>\n        Latham, I. J.<\/dc:creator><dc:creator>\n        Le Gallou, R.<\/dc:creator><dc:creator>\n        Lemoine, M.<\/dc:creator><dc:creator>\n        Lemi\u00e8re, A.<\/dc:creator><dc:creator>\n        Leroy, N.<\/dc:creator><dc:creator>\n        Lohse, T.<\/dc:creator><dc:creator>\n        Marcowith, A.<\/dc:creator><dc:creator>\n        Masterson, C.<\/dc:creator><dc:creator>\n        McComb, T. J. L.<\/dc:creator><dc:creator>\n        de Naurois, M.<\/dc:creator><dc:creator>\n        Nolan, S. J.<\/dc:creator><dc:creator>\n        Noutsos, A.<\/dc:creator><dc:creator>\n        Orford, K. J.<\/dc:creator><dc:creator>\n        Osborne, J. L.<\/dc:creator><dc:creator>\n        Ouchrif, M.<\/dc:creator><dc:creator>\n        Panter, M.<\/dc:creator><dc:creator>\n        Pelletier, G.<\/dc:creator><dc:creator>\n        Pita, S.<\/dc:creator><dc:creator>\n        Pohl, M.<\/dc:creator><dc:creator>\n        P\u00fchlhofer, G.<\/dc:creator><dc:creator>\n        Punch, M., M.<\/dc:creator><dc:creator>\n        Raubenheimer, B. C.<\/dc:creator><dc:creator>\n        Raue, M.<\/dc:creator><dc:creator>\n        Raux, J.<\/dc:creator><dc:creator>\n        Rayner, S. M.<\/dc:creator><dc:creator>\n        Redondo, I.<\/dc:creator><dc:creator>\n        Reimer, A,<\/dc:creator><dc:creator>\n        Reimer, O.<\/dc:creator><dc:creator>\n        Ripken, J.<\/dc:creator><dc:creator>\n        Rivoal, M.<\/dc:creator><dc:creator>\n        Rob, L.<\/dc:creator><dc:creator>\n        Rolland, L.<\/dc:creator><dc:creator>\n        Rowell, G.<\/dc:creator><dc:creator>\n        Sahakian, V.<\/dc:creator><dc:creator>\n        Saug\u00e9, L.<\/dc:creator><dc:creator>\n        Schlenker, S.<\/dc:creator><dc:creator>\n        Schlickeiser, R.<\/dc:creator><dc:creator>\n        Schuster, C.<\/dc:creator><dc:creator>\n        Schwanke, U.<\/dc:creator><dc:creator>\n        Siewert, M.<\/dc:creator><dc:creator>\n        Sol, H.<\/dc:creator><dc:creator>\n        Steenkamp, R.<\/dc:creator><dc:creator>\n        Stegmann, C.<\/dc:creator><dc:creator>\n        Tavernet, J.-P.<\/dc:creator><dc:creator>\n        Th\u00e9oret, C. G.<\/dc:creator><dc:creator>\n        Tluczykont, M.<\/dc:creator><dc:creator>\n        van der Walt, D. J.<\/dc:creator><dc:creator>\n        Vasileiadis, G.<\/dc:creator><dc:creator>\n        Vincent, P.<\/dc:creator><dc:creator>\n        Visser, B.<\/dc:creator><dc:creator>\n        V\u00f6lk, H. J.<\/dc:creator><dc:creator>\n        Wagner, S. J.<\/dc:creator><dc:description>\n        We report the detection of a point-like source of very high energy (VHE) -rays coincident within  1' of Sgr A *, obtained with the HESS array of Cherenkov telescopes. The -rays exhibit a power-law energy spectrum with a spectral index of  and a flux above the 165 GeV threshold of  m -2 s -1. The measured flux and spectrum differ substantially from recent results reported in particular by the CANGAROO collaboration.<\/dc:description><dc:subject>\n        Gamma-rays<\/dc:subject><dc:subject>\n         Observations<\/dc:subject><dc:subject>\n         Galaxy centre.<\/dc:subject><dc:publisher>\n        EDP Sciences<\/dc:publisher><dc:source>\n        Astronomy & astrophysics, 2004, Vol.425(1), pp.L13-L17 [Peer Reviewed Journal]<\/dc:source><dc:date>\n        2004-10-01<\/dc:date><dc:type>\n        Article<\/dc:type><dc:type>\n        PeerReviewed<\/dc:type><dc:identifier>\n        dro:1507<\/dc:identifier><dc:identifier>\n        issn:0004-6361<\/dc:identifier><dc:identifier>\n        issn: 1432-0746<\/dc:identifier><dc:identifier>\n        doi:10.1051\/0004-6361:200400055<\/dc:identifier><dc:identifier>\n        http:\/\/dro.dur.ac.uk\/1507\/<\/dc:identifier><dc:identifier>\n        https:\/\/doi.org\/10.1051\/0004-6361:200400055<\/dc:identifier><dc:format>\n        application\/pdf<\/dc:format><dc:identifier>\n        http:\/\/dro.dur.ac.uk\/1507\/1\/1507.pdf<\/dc:identifier><dc:rights>\n        Reproduced with permission from Astronomy & Astrophysics, \u00a9 ESO<\/dc:rights><dc:accessRights>\n        info:en-repo\/semantics\/openAccess<\/dc:accessRights><\/oai_dc:dc><\/metadata><\/record>","journals":[{"title":null,"identifiers":[" 1432-0746","0004-6361","issn:0004-6361","issn: 1432-0746"]}],"language":{"code":"en","id":9,"name":"English"},"relations":[],"year":2004,"topics":["Gamma-rays","Observations","Galaxy centre."],"subject":["Article","PeerReviewed"],"fullText":"Durham Research Online\nDeposited in DRO:\n29 May 2008\nVersion of attached file:\nPublished Version\nPeer-review status of attached file:\nPeer-reviewed\nCitation for published item:\nAharonian,, F. and Akhperjanian, A. G. and Aye, K.-M. and Bazer-Bachi, A. R. and Beilicke, M. and\nBenbow, W. and Berge, D. and Berghaus, P. and Bernlhr, K. and Bolz, O. and Boisson, C. and Borgmeier, C.\nand Breitling, F. and Brown, A. M. and Bussons Gordo, J. and Chadwick, P. M. and Chitnis, V. R. and\nChounet, L.-M. and Cornils, R. and Costamante, L. and Degrange, B. and Djannati-Ata, A. O\u2019C. and Drury,\nL. and Ergin, T. and Espigat, P. and Feinstein, F. and Fleury, P. and Fontaine, G. and Funk, S. and Gallant,\nY. and Giebels, B. and Gillessen, S. and Goret, P. and Guy, J. and Hadjichristidis, C. and Hauser, M. and\nHeinzelmann, G. and Henri, G. and Hermann, G. and Hinton, J. A. and Hofmann, W. and Holleran, M. and\nHorns, D. and de Jager, O. C. and Jung, I. and Khlifi, B. and Komin, N. and Konopelko, A. and Latham, I. J.\nand Le Gallou, R. and Lemoine, M. and Lemire, A. and Leroy, N. and Lohse, T. and Marcowith, A. and\nMasterson, C. and McComb, T. J. L. and de Naurois, M. and Nolan, S. J. and Noutsos, A. and Orford, K. J.\nand Osborne, J. L. and Ouchrif, M. and Panter, M. and Pelletier, G. and Pita, S. and Pohl, M. and Phlhofer,\nG. and Punch, M., M. and Raubenheimer, B. C. and Raue, M. and Raux, J. and Rayner, S. M. and Redondo,\nI. and Reimer, A, and Reimer, O. and Ripken, J. and Rivoal, M. and Rob, L. and Rolland, L. and Rowell, G.\nand Sahakian, V. and Saug, L. and Schlenker, S. and Schlickeiser, R. and Schuster, C. and Schwanke, U. and\nSiewert, M. and Sol, H. and Steenkamp, R. and Stegmann, C. and Tavernet, J.-P. and Thoret, C. G. and\nTluczykont, M. and van der Walt, D. J. and Vasileiadis, G. and Vincent, P. and Visser, B. and Vlk, H. J. and\nWagner, S. J. (2004) \u2019Very high energy gamma rays from the direction of Sagittarius A*.\u2019, Astronomy\nastrophysics., 425 (1). L13-L17.\nFurther information on publisher\u2019s website:\nhttp:\/\/dx.doi.org\/10.1051\/0004-6361:200400055\nPublisher\u2019s copyright statement:\nAdditional information:\nUse policy\nThe full-text may be used and\/or reproduced, and given to third parties in any format or medium, without prior permission or charge, for\npersonal research or study, educational, or not-for-profit purposes provided that:\n\u2022 a full bibliographic reference is made to the original source\n\u2022 a link is made to the metadata record in DRO\n\u2022 the full-text is not changed in any way\nThe full-text must not be sold in any format or medium without the formal permission of the copyright holders.\nPlease consult the full DRO policy for further details.\nDurham University Library, Stockton Road, Durham DH1 3LY, United Kingdom\nTel : +44 (0)191 334 3042 \u2014 Fax : +44 (0)191 334 2971\nhttp:\/\/dro.dur.ac.uk\n2\n Durham Research Online \n \nDeposited in DRO: \n29 May 2008. \n \nVersion of attached file: \nPublished. \n \nPeer-review status of attached file: \nPeer-reviewed. \n \nCitation for published item: \nAharonian,, F. and Akhperjanian, A. G. and Aye, K.-M. and Bazer-Bachi, A. R. and \nBeilicke, M. and Benbow, W. and Berge, D. and Berghaus, P. and Bernl\u00f6hr, K. and \nBolz, O. and Boisson, C. and Borgmeier, C. and Breitling, F. and Brown, A. M. and \nBussons Gordo, J. and Chadwick, P. M. and Chitnis, V. R. and Chounet, L.-M. and \nCornils, R. and Costamante, L. and Degrange, B. and Djannati-Ata\u00ef, A. O'C. and \nDrury, L. and Ergin, T. and Espigat, P. and Feinstein, F. and Fleury, P. and Fontaine, \nG. and Funk, S. and Gallant, Y. and Giebels, B. and Gillessen, S. and Goret, P. and \nGuy, J. and Hadjichristidis, C. and Hauser, M. and Heinzelmann, G. and Henri, G. and \nHermann, G. and Hinton, J. A. and Hofmann, W. and Holleran, M. and Horns, D. and \nde Jager, O. C. and Jung, I. and Kh\u00e9lifi, B. and Komin, N. and Konopelko, A. and \nLatham, I. J. and Le Gallou, R. and Lemoine, M. and Lemi\u00e8re, A. and Leroy, N. and \nLohse, T. and Marcowith, A. and Masterson, C. and McComb, T. J. L. and de Naurois, \nM. and Nolan, S. J. and Noutsos, A. and Orford, K. J. and Osborne, J. L. and Ouchrif, \nM. and Panter, M. and Pelletier, G. and Pita, S. and Pohl, M. and P\u00fchlhofer, G. and \nPunch, M., M. and Raubenheimer, B. C. and Raue, M. and Raux, J. and Rayner, S. M. \nand Redondo, I. and Reimer, A, and Reimer, O. and Ripken, J. and Rivoal, M. and \nRob, L. and Rolland, L. and Rowell, G. and Sahakian, V. and Saug\u00e9, L. and Schlenker, \nS. and Schlickeiser, R. and Schuster, C. and Schwanke, U. and Siewert, M. and Sol, \nH. and Steenkamp, R. and Stegmann, C. and Tavernet, J.-P. and Th\u00e9oret, C. G. and \nTluczykont, M. and van der Walt, D. J. and Vasileiadis, G. and Vincent, P. and Visser, \nB. and V\u00f6lk, H. J. and Wagner, S. J. (2004) 'Very high energy gamma rays from the \ndirection of Sagittarius A*.' , Astronomy & astrophysics., 425 (1), L13-L17. \n \nFurther information on publisher\u2019s website: \nhttp:\/\/dx.doi.org\/10.1051\/0004-6361:200400055 \n Use policy \n \nThe full-text may be used and\/or reproduced, and given to third parties in any format or medium, without \nprior permission or charge, for personal research or study, educational, or not-for-profit purposes \nprovided that : \n \n\u0083 a full bibliographic reference is made to the original source \n\u0083 a link is made to the metadata record in DRO \n\u0083 the full-text is not changed in any way \n \nThe full-text must not be sold in any format or medium without the formal permission of the copyright \nholders.  \n \nDurham University Library, Stockton Road, Durham DH1 3LY, United Kingdom \nTel : +44 (0)191 334 3042 | Fax : +44 (0)191 334 2971 \nhttp:\/\/dro.dur.ac.uk \n \nA&A 425, L13\u2013L17 (2004)\nDOI: 10.1051\/0004-6361:200400055\nc\u00a9 ESO 2004\nAstronomy\n&Astrophysics\nVery high energy gamma rays from the direction of Sagittarius A\u2217\nF. Aharonian1, A. G. Akhperjanian2, K.-M. Aye3, A. R. Bazer-Bachi4, M. Beilicke5, W. Benbow1, D. Berge1,\nP. Berghaus6, K. Bernl\u00f6hr1,7, O. Bolz1, C. Boisson8, C. Borgmeier7, F. Breitling7, A. M. Brown3, J. Bussons Gordo9,\nP. M. Chadwick3, V. R. Chitnis10,20 ,\u0001, L.-M. Chounet11, R. Cornils5, L. Costamante1,20, B. Degrange11,\nA. Djannati-Ata\u00ef6, L. O\u2019C. Drury12, T. Ergin7, P. Espigat6, F. Feinstein9, P. Fleury11, G. Fontaine11, S. Funk1,\nY. Gallant9, B. Giebels11, S. Gillessen1, P. Goret13, J. Guy10, C. Hadjichristidis3 , M. Hauser14, G. Heinzelmann5,\nG. Henri15, G. Hermann1, J. A. Hinton1, W. Hofmann1, M. Holleran16, D. Horns1, O. C. de Jager16, I. Jung1,14 ,\u0001\u0001,\nB. Kh\u00e9lifi1, Nu. Komin7, A. Konopelko1,7, I. J. Latham3, R. Le Gallou3, M. Lemoine11, A. Lemi\u00e8re6, N. Leroy11,\nT. Lohse7, A. Marcowith4, C. Masterson1,20, T. J. L. McComb3, M. de Naurois10, S. J. Nolan3, A. Noutsos3,\nK. J. Orford3, J. L. Osborne3, M. Ouchrif10,20, M. Panter1, G. Pelletier15, S. Pita6, M. Pohl17,\u0001\u0001\u0001, G. P\u00fchlhofer1,14,\nM. Punch6, B. C. Raubenheimer16, M. Raue5, J. Raux10, S. M. Rayner3, I. Redondo11,20 ,\u2020, A. Reimer17,\nO. Reimer17, J. Ripken5, M. Rivoal10, L. Rob18, L. Rolland10, G. Rowell1, V. Sahakian2, L. Saug\u00e915, S. Schlenker7,\nR. Schlickeiser17 , C. Schuster17, U. Schwanke7, M. Siewert17, H. Sol8, R. Steenkamp19, C. Stegmann7,\nJ.-P. Tavernet10, C. G. Th\u00e9oret6, M. Tluczykont11,20, D. J. van der Walt16, G. Vasileiadis9, P. Vincent10,\nB. Visser16, H. J. V\u00f6lk1, and S. J. Wagner14\n1 Max-Planck-Institut f\u00fcr Kernphysik, PO Box 103980, 69029 Heidelberg, Germany\ne-mail: Jim.Hinton@mpi-hd.mpg.de\n2 Yerevan Physics Institute, 2 Alikhanian Brothers St., 375036 Yerevan, Armenia\n3 University of Durham, Department of Physics, South Road, Durham DH1 3LE, UK\n4 Centre d\u2019\u00c9tude Spatiale des Rayonnements, CNRS\/UPS, 9 Av. du Colonel Roche, BP 4346, 31029 Toulouse Cedex 4, France\n5 Universit\u00e4t Hamburg, Inst. f\u00fcr Experimentalphysik, Luruper Chaussee 149, 22761 Hamburg, Germany\n6 Physique Corpusculaire et Cosmologie, IN2P3\/CNRS, Coll\u00e8ge de France, 11 place Marcelin Berthelot,\n75231 Paris Cedex 05, France\n7 Institut f\u00fcr Physik, Humboldt-Universit\u00e4t zu Berlin, Newtonstr. 15, 12489 Berlin, Germany\n8 LUTH, UMR 8102 du CNRS, Observatoire de Paris, Section de Meudon, 92195 Meudon Cedex, France\n9 Groupe d\u2019Astroparticules de Montpellier, IN2P3\/CNRS, Universit\u00e9 Montpellier II, CC85, Place Eug\u00e8ne Bataillon,\n34095 Montpellier Cedex 5, France\n10 Laboratoire de Physique Nucl\u00e9aire et de Hautes \u00c9nergies, IN2P3\/CNRS, Universit\u00e9s Paris VI & VII, 4 place Jussieu,\n75231 Paris Cedex 05, France\n11 Laboratoire Leprince-Ringuet, IN2P3\/CNRS, \u00c9cole Polytechnique, 91128 Palaiseau, France\n12 Dublin Institute for Advanced Studies, 5 Merrion Square, Dublin 2, Ireland\n13 Service d\u2019Astrophysique, DAPNIA\/DSM\/CEA, CE Saclay, 91191 Gif-sur-Yvette, France\n14 Landessternwarte, K\u00f6nigstuhl, 69117 Heidelberg, Germany\n15 Laboratoire d\u2019Astrophysique de Grenoble, INSU\/CNRS, Universit\u00e9 Joseph Fourier, BP 53, 38041 Grenoble Cedex 9, France\n16 Unit for Space Physics, North-West University, Potchefstroom 2520, South Africa\n17 Institut f\u00fcr Theoretische Physik, Lehrstuhl IV: Weltraum und Astrophysik, Ruhr-Universit\u00e4t Bochum, 44780 Bochum,\nGermany\n18 Institute of Particle and Nuclear Physics, Charles University, V Holesovickach 2, 180 00 Prague 8, Czech Republic\n19 University of Namibia, Private Bag 13301, Windhoek, Namibia\n20 European Associated Laboratory for Gamma-Ray Astronomy, jointly supported by CNRS and MPG\nReceived 29 June 2004 \/ Accepted 12 August 2004\n\u0001 Now at Tata Institute of Fundamental Research, Homi Bhabha\nRoad, Mumbai 400 005, India.\n\u0001\u0001 Now at Washington Univ., Department of Physics, 1 Brookings\nDr., CB 1105, St. Louis, MO 63130, USA.\n\u0001\u0001\u0001 Now at Department of Physics and Astronomy, Iowa State\nUniversity, Ames, Iowa 50011-3160, USA.\n\u2020 Now at Department of Physics and Astronomy, Univ. of Sheffield,\nThe Hicks Building, Hounsfield Road, Sheffield S3 7RH, UK.\nLe\ntte\nr\u00a0t\no\u00a0\nth\ne\u00a0\nEd\nito\nr\nL14 F. Aharonian et al.: Very high energy gamma rays from the direction of Sagittarius A\u2217\nAbstract. We report the detection of a point-like source of very high energy (VHE) \u03b3-rays coincident within 1\u2032 of Sgr A\u2217, obtained with the\nHESS array of Cherenkov telescopes. The \u03b3-rays exhibit a power-law energy spectrum with a spectral index of \u22122.2 \u00b1 0.09 \u00b1 0.15 and a flux\nabove the 165 GeV threshold of (1.82 \u00b1 0.22) \u00d7 10\u22127 m\u22122 s\u22121. The measured flux and spectrum differ substantially from recent results reported\nin particular by the CANGAROO collaboration.\nKey words. gamma-rays: observations \u2013 Galaxy: centre\n1. Introduction\nThe Galactic Centre (GC) region (Melia & Falcke 2001) har-\nbours a variety of potential sources of high-energy radiation\nincluding the supermassive black hole Sgr A\u2217 of 2.6 \u00d7 106 M\u0004\n(see e.g. Sch\u00f6del et al. 2002), which has been identified as a\nfaint source of X-rays (Baganoff et al. 2003) and infrared radi-\nation (Genzel et al. 2003). Emission from Sgr A\u2217 is presumably\npowered by the energy released in the accretion of stellar winds\nonto the black hole (Melia 1992; Yusef-Zadeh et al. 2000; Yuan\net al. 2003).\nHigh (Mayer-Hasselwander et al. 1998) and very high\n(Tsuchiya et al. 2004; Kosack et al. 2004) energy \u03b3-ray\nemission have also been detected from the GC region. The\n\u03b3-radiation could result from acceleration of electrons or pro-\ntons in shocks in these winds, in the accretion flow or in nearby\nsupernova remnants, followed by interactions of accelerated\nparticles with ambient matter or radiation. Alternative mech-\nanisms include the annihilation of dark matter particles accu-\nmulating at the GC (Bergstr\u00f6m et al. 1998; Ellis et al. 2002;\nGnedin & Primack 2003) or curvature radiation of protons near\nthe black hole (Levinson 2000).\n2. Observations and results\nThe observations presented here were obtained in Summer\n2003 with the High Energy Stereoscopic System (HESS),\nconsisting of four imaging atmospheric Cherenkov telescopes\n(Hofmann 2003; Bernl\u00f6hr et al. 2003; Vincent et al. 2003) in\nNamibia, at 23\u25e616\u2032 S 16\u25e630\u2032 E. At this time, two of the four\ntelescopes were operational, the other two being under con-\nstruction. During the first phase of the measurements (June 6\nto July 7, 2003), the telescopes were operated independently\nand images were combined offline using GPS time stamps\n(4.7 h on source, \u201cJune\/July\u201d data set). In the second phase\n(July 22 to August 29, 2003), a hardware coincidence required\nshower images simultaneously in both telescopes (11.8 h on\nsource, \u201cJuly\/August\u201d data set). The resulting background sup-\npression allowed us to lower the telescope trigger thresholds,\nyielding a post-cuts energy threshold of 165 GeV (for typical\nSgr A\u2217 zenith angles of 20\u25e6) as compared to 255 GeV for the\n\u201cJune\/July\u201d data set.\nShower images are parametrised by their centres of gravity\nand second moments, followed by the stereoscopic reconstruc-\ntion of shower geometry, providing an angular resolution of\n\u22480.1\u25e6 for individual \u03b3-rays. \u03b3-ray candidates are selected based\non the shape of shower images, allowing effective suppression\nof cosmic-ray showers. The \u03b3-ray energy is estimated from the\nimage intensity and the reconstructed shower geometry, with a\ntypical resolution of 15\u201320%.\n 17h48m  17h45m  17h42m\n4\n0\n8\n12\n16\n20\n\u221230  0\u2019\n\u221229  0\u2019\n\u221228  0\u2019\no\no\no\no\n b = 0 \nFig. 1. Angular distribution of \u03b3-ray candidates for a 3\u25e6 field of view\ncentred on Sgr A\u2217. Both data sets (\u201cJune\/July\u201d and \u201cJuly\/August\u201d) are\ncombined, employing tight cuts to reduce the level of background. The\nsignificance of the feature extending along the Galactic Plane is under\ninvestigation.\nThe GC region is characterised by high night-sky bright-\nness (NSB), varying across the field of view and potentially\ninterfering with image reconstruction. Simulations of a range\nof NSB levels show, however, that the stereoscopic reconstruc-\ntion is insensitive to this feature, resulting in variations of the\nmeasured flux and spectrum that are well within the systematic\nerrors quoted here.\nThe performance and stability of HESS have been con-\nfirmed by observations of the Crab Nebula (a standard candle\nin \u03b3-ray astronomy). The absolute calibration of the instrument\nhas been verified using muon images (Leroy et al. 2003) which\nprovide a measurement of the absolute photon detection effi-\nciency, and by the measured cosmic ray detection rates (Funk\net al. 2004), which are in excellent agreement with simulations.\nFigure 1 shows the distribution of \u03b3-ray candidates for a 3\u25e6\nwindow around Sgr A\u2217. A clear excess of events in the Sgr A\u2217\nregion is observed. Here, tight \u03b3-ray selection cuts are applied\nto minimise background at the expense of \u03b3-ray efficiency. For\nthe analysis of the flux and spectrum of the central point source,\nlooser cuts are used which reject 96% of the cosmic-ray back-\nground and retain 50% of the \u03b3-rays. Using a ring around the\nassumed source location to estimate background, we find \u2013\nwith loose cuts \u2013 a 6.1 \u03c3 excess in the \u201cJune\/July\u201d data set and\na 9.2 \u03c3 excess in the \u201cJuly\/August\u201d data set, both centred on\nSgr A\u2217. The \u03b3-ray excess is located at RA 17h45m41.3s \u00b1 2.0s,\nDec\u221229\u25e60\u203222\u2032\u2032\u00b132\u2032\u2032, or l = 359\u25e656\u203253\u2032\u2032, b = \u22120\u25e62\u203257\u2032\u2032, within\nLe\ntte\nr\u00a0t\no\u00a0\nth\ne\u00a0\nEd\nito\nr\nF. Aharonian et al.: Very high energy gamma rays from the direction of Sagittarius A\u2217 L15\nFig. 2. Centre of gravity of the VHE signal (triangle), superimposed on\na 8.5\u2032 by 8.5\u2032 Chandra X-ray map (Muno et al. 2003) of the GC. The\nlocation of Sgr A\u2217 is indicated by a cross. The contour lines indicate\nthe 68% and 95% confidence regions for the source position, taking\ninto account systematic pointing errors of 20\u2032\u2032 . The white dashed line\ngives the 95% confidence level upper limit on the rms source size. The\nresolution for individual VHE photons \u2013 as opposed to the precision\nfor the centre of the VHE signal \u2013 is 5.8\u2032 (50% containment radius).\n14 \u00b1 30\u2032\u2032 in b and 12 \u00b1 30\u2032\u2032 in l from Sgr A\u2217 (Fig. 2). There is\nno evidence in our data for an energy dependence of this posi-\ntion. A conservative pointing error of less than 20\u2032\u2032 in RA and\nDec has been estimated using stars (Gillessen et al. 2003), and\nverified by reconstructing the location of known VHE sources\nsuch as the Crab Nebula and the AGN PKS 2155\u2212304.\nGiven the high density of potential sources over the cen-\ntral square degree of the Galaxy, an important question is\nwhether the VHE \u03b3-ray signal shows signs of source exten-\nsion. Figure 3 shows the angular distribution of detected \u03b3-rays\nrelative to Sgr A\u2217. The width and shape of this distribution\nare consistent with point source simulations. These simula-\ntions have been verified using the strong signals from the Crab\nNebula and PKS 2155\u2212304. Assuming a Gaussian distribution\nof source brightness, \u03c1 \u221d exp(\u2212\u03b82\/2\u03c32source), we find an upper\nlimit \u03c3source < 3\u2032 for the source size (95% CL), corresponding\nto <7 pc at the distance of the GC (dashed white line in Fig. 2).\nThe apparent point-like nature of the central source does not\nexclude the possibility of non-azimuthally symmetric tails in\nthe emission.\nThe measured energy spectrum is shown in Fig. 4. Data are\nfit by a power-law, F(E) = F0E\u2212\u03b1TeV, with a spectral index \u03b1 =\n2.21\u00b10.09 and F0 = (2.50\u00b10.21)\u00d710\u22128 m\u22122 s\u22121 TeV\u22121 for the\n\u201cJuly\/August\u201d data set (full circles), with a \u03c72\/d.o.f. of 0.6. The\nflux above the 165 GeV threshold is (1.82\u00b10.22)\u00d710\u22127 m\u22122 s\u22121,\nequivalent to 5% of the Crab Nebula flux at this threshold.\nThe smaller \u201cJune\/July\u201d data set gives consistent results (\u03b1 =\n2.11 \u00b1 0.19 and F0 = (2.76 \u00b1 0.33) \u00d7 10\u22128 m\u22122 s\u22121 TeV\u22121). We\nestimate systematic errors of \u2206\u03b1 \u2248 0.15 and \u2206F\/F \u2248 25%,\nwith the latter mainly governed by the precision of the energy\n)2 (degrees2\u03b8\n0 0.01 0.02 0.03 0.04\nEx\nce\nss\n E\nve\nnt\ns\n\u221250\n0\n50\n100\n150\n0 0.010\n100\n200\n0.02 0.03 0.04\nFig. 3. Angular distribution of VHE \u03b3-rays relative to the location of\nSgr A\u2217. Inset: distributions in \u03b82 where \u03b8 is the angle between the\n\u03b3-ray direction and Sgr A\u2217; a uniform background results in a flat dis-\ntribution in \u03b82. Full points: signal region; open points: background\nregion. The main figure shows background-subtracted excess counts.\nThe solid line indicates the distribution expected for a point source of\n\u03b3-rays at the position of Sgr A\u2217.\ncalibration of the instrument. The energy reconstruction and\nflux determination have been tested with the Crab Nebula; we\nreconstruct a power law with index \u03b1 = 2.63 \u00b1 0.04 and a flux\nabove 1 TeV of (1.98\u00b10.08)\u00d710\u22127 m\u22122 s\u22121 for the Crab, in very\ngood agreement with previous measurements (see Aharonian\net al. 2000, and references therein). Fitting the GC \u03b3-ray spec-\ntrum as a power law with an exponential cutoff, we find a lower\nlimit for the cutoff energy of 4 TeV. Within statistics, there are\nno indications for time variability of the GC signal.\n3. Discussion and conclusions\nThe CANGAROO collaboration recently reported the detec-\ntion of sub-TeV gamma rays from within 0.1\u25e6 of the GC based\non 67 h of (on-source) data taken in July 2001 and July\/August\n2002 (Tsuchiya et al. 2004). The reported spectrum is very\nsteep, F(E) \u221d E\u22124.6\u00b10.5. The rather hard HESS spectra are ob-\nviously not consistent with the steep spectrum obtained with\nCANGAROO-II (Fig. 4); the large flux at low energies im-\nplied by the CANGAROO result would have been detected\nwith HESS in a matter of minutes. At higher energies, above\n2.8 TeV, a marginal detection with a significance of 3.7 \u03c3\nresulting from 26 h of large-zenith-angle observations in the\nyears 1995 through 2003 was reported by the Whipple collab-\noration (Kosack et al. 2004), consistent with Sgr A\u2217 within the\n15\u2032 95% C.L. error circle. The Whipple flux is a factor 3 above\nthat implied by our spectra. Taking all data at face value, one\nwould conclude that the source underwent significant changes\nover the timescale of one year (2002 to 2003). However, this\nseems unlikely since none of the individual experiments de-\ntects significant variability. Implications of the CANGAROO\nand Whipple data are discussed in Hooper et al. (2004).\nAt lower energies around 100 MeV, the EGRET instrument\ndetected a strong excess from the central part of the Galaxy\nLe\ntte\nr\u00a0t\no\u00a0\nth\ne\u00a0\nEd\nito\nr\nL16 F. Aharonian et al.: Very high energy gamma rays from the direction of Sagittarius A\u2217\nEnergy (TeV)10\n-1 1 10\n \nTe\nV)\n-\n1\n \ns\n-\n2\n \ndN\n\/d\nE \n (m\n2 E\n10\n-9\n10\n-8\n10\n-7\n10\n-6\nHESS June\/July\nHESS July\/August\nCANGAROO-II\nWhipple\n10-5 10-4 10-3 10-2 10-1 1 10\n10-9\n10-8\n10-7\n10-6\n10\n-5\n10\n-4\n10-3\nEGRET\nFig. 4. Energy spectrum E2dN\/dE of \u03b3-rays from the Galactic Centre.\nFull circles: HESS \u201cJuly\/August 2003\u201d data set. Full triangles: HESS\n\u201cJune\/July 2003\u201d data set. The line indicates a power-law fit to the\n\u201cJuly\/August\u201d spectrum. Open squares: CANGAROO-II spectrum\nfrom Summer 2001 and 2002 (Tsuchiya et al. 2004). Open triangle:\nWhipple flux from 1995 through 2003 (Kosack et al. 2004), converted\nto a differential flux at the peak detection energy assuming a Crab-\nlike spectrum. The inset shows the EGRET flux from 1991 to 1996\n(Mayer-Hasselwander et al. 1998) (circles) compared to fits to the\nCANGAROO-II (dashed line) and HESS (solid line) spectra. Due to\nthe poor angular resolution of EGRET (1\u25e6) the flux shown may include\nother sources.\n(Mayer-Hasselwander et al. 1998), consistent within its error\ncircle with Sgr A\u2217, but with angular resolution of 1\u25e6 also cov-\nering other potential sources (and a solid angle \u223c100 times\nlarger than the emission region seen by HESS). In the anal-\nysis of a high-energy sub-sample of EGRET data (Hooper &\nDingus 2002), the source was found to be offset from the GC\nby 0.21\u25e6, excluding Sgr A\u2217 at 99.9% C.L.\nModels for the wide-band spectra of Sgr A\u2217 in-\nclude Advection Dominated Accretion Flow (ADAF) models\n(Narayan et al. 1998; Yuan et al. 2003), possibly combined\nwith a jet extracting energy from the accretion disk (Yuan\net al. 2002). Shocks in the accretion flow (Markoff et al. 1997)\nor in the jet could accelerate particles. \u03b3-rays are generated in\nproton interactions, but predicted spectra tend to fall off rapidly\nin the TeV region (Markoff et al. 1997).\nAnother source of VHE \u03b3-rays should be diffuse emission\nfrom the entire central region, in which case year time-scale\nvariability should not occur. \u03b3-rays may result from interac-\ntions of accelerated protons and nuclei (Fatuzzo & Melia 2003)\nwith the ambient matter with a density as large as n = 103 cm\u22123\n(Maeda et al. 2002). Only modest overall energy, Wp \t 5 \u00d7\n1047(103 cm\u22123\/n) erg, in TeV protons is needed to explain the\nobserved \u03b3-ray flux from this region (the 1\u201310 TeV luminosity\nis \u223c1035 ergs\/s). An obvious candidate for the proton acceler-\nator could be the young (104 yr) and unusually powerful (total\nexplosion energy \t4\u00d7 1052 erg) supernova remnant Sgr A East\n(Maeda et al. 2002). The measured spectral index of TeV emis-\nsion, \u03b1 \u2248 2.2, is close to the spectrum of shock-accelerated\nparticles. For a 104 yr source age, the modest source exten-\nsion and the hard spectrum imply that particle diffusion in the\ncentral region proceeds much slower compared to the diffusion\nin the Galactic Disk. While detailed modelling remains to be\ndone, estimates show that for magnetic fields up to \u223c1 mG the\nX-ray and radio emission resulting from secondary electrons\ngenerated in interactions of such accelerated protons are below\nthe measured diffuse luminosities integrated over Sgr A East.\nThis consistency criterion is, however, much more challeng-\ning if one considers Sgr A* as the source, with its significantly\nlarger magnetic fields and lower (quiescent-state) X-ray flux.\nIn either case, the explanation of the EGRET flux (Fig. 4) re-\nquires a second source component with a cutoff close to the\nhighest EGRET energies, located well within the HESS field of\nview (and therefore excluded as a strong TeV source), but not\nnecessarily coincident with Sgr A East or Sgr A*. We note that\nTsuchiya et al. (2004) describe the EGRET and CANGAROO\nfluxes jointly in a model of a diffuse proton flux with a spec-\ntral cutoff of a few TeV, interacting with ambient gas. In such a\nmodel, one would, however, not expect fast variability.\nAlternative mechanisms invoke the hypothetical annihi-\nlation of super-symmetric dark matter particles (Bergstr\u00f6m\net al. 1998; Ellis et al 2002; Gnedin & Primack 2003) or cur-\nvature radiation of protons in the vicinity of the central super-\nmassive black hole (Levinson 2000).\nThe spectrum of \u03b3-rays from hypothetical annihilation of\nneutralinos of mass M\u03c7 consists of a \u03b3-ray continuum and\ntwo lines at E = M\u03c7 and E = M\u03c7(1 \u2212 m2Z\/4M2\u03c7). The con-\ntinuum spectra generated by the DarkSusy program (Gondolo\net al. 2004) are well approximated by F \u223c E\u2212\u03b1e\u2212(E\/Mcut ) with\n\u03b1 = 2.2...2.4 and Mcut = 0.15...0.3M\u03c7 depending on the annihi-\nlation channel 1. Assuming that the observed \u03b3-rays represent\na continuum annihilation spectrum, the lower limit of 4 TeV\non the cutoff implies M\u03c7 > 12 TeV, a range which is presently\ndisfavoured due to particle physics and cosmology arguments\n(Ellis et al. 2003). Supersymmetric dark matter annihilation as\nthe main source of the observed \u03b3-rays is therefore unlikely, but\nnot excluded.\nThe spectrum of the proton curvature radiation\n(Levinson 2000) depends, to a large extent, on the con-\nfiguration of magnetic fields near the gravitational radius\nof the black hole, and detailed predictions are lacking; as\na characteristic feature, one would expect time variability.\nFurther observations of the GC region are a high priority for\nHESS in the near future.\nAcknowledgements. The support of the Namibian authorities and of\nthe University of Namibia in facilitating the construction and op-\neration of HESS is gratefully acknowledged, as is the support by\nthe German Ministry for Education and Research (BMBF), the Max\nPlanck Society, the French Ministry for Research, the CNRS-IN2P3\nand the Astroparticle Interdisciplinary Programme of the CNRS, the\n1 Bergstr\u00f6m et al. (1998) use \u03b1 = 1.5 and Mcut = 0.13M\u03c7 to de-\nscribe spectra for E < 0.5M\u03c7, but with larger \u03b1 values a better fit up\nto E = 0.9M\u03c7 is obtained.\nLe\ntte\nr\u00a0t\no\u00a0\nth\ne\u00a0\nEd\nito\nr\nF. Aharonian et al.: Very high energy gamma rays from the direction of Sagittarius A\u2217 L17\nUK Particle Physics and Astronomy Research Council (PPARC),\nthe IPNP of the Charles University, the South African Department\nof Science and Technology and National Research Foundation, and\nby the University of Namibia. We appreciate the excellent work of\nthe technical support staff in Berlin, Durham, Hamburg, Heidelberg,\nPalaiseau, Paris, Saclay, and in Namibia in the construction and oper-\nation of the equipment.\nReferences\nAharonian, F. A., Akhperjanian, A. G., Barrio, J. A., et al. 2000, ApJ,\n539, 317\nBaganoff, F. K., Maeda, Y., Morris, M., et al. 2003, ApJ, 591, 891\nBergstr\u00f6m, L., Ullio, P., & Buckley, J. H. 1998, APh, 9, 137\nBernl\u00f6hr, K., Carrol, O., Cornils, R., et al. 2003, APh, 20, 111\nEllis, J. R., Feng, J. L., Ferstl, A., Matchev, K. T., & Olive, K. A. 2002,\nEur. Phys. J., C24, 311\nEllis, J., Olive, K. A., Santoso, Y., & Spanos, V. C. 2003, Phys. Lett.\nB, 565, 176\nFatuzzo, M., & Melia, F. 2003, ApJ, 596, 1035\nFunk, S., Hermann, G., Hinton, J., et al. 2004, APh, submitted\nGenzel, R., Sch\u00f6del, R., Ott, T., et al. 2003, Nature, 425, 934\nGillessen, S. for the HESS collaboration 2003 Proc. 28th ICRC,\nTsukuba (Tokyo: Univ. Academy Press), 2899\nGnedin, O. Y., & Primack, J. R. 2003, Phys. Rev. Lett., submitted\n[arXiv:astro-ph\/0308385]\nGondolo, P., Edsj\u00f6, J., Ullio, P., et al. 2004, JCAP 0407, 008\nHofmann, W. 2003, Proc. 28th ICRC, Tsukuba (Tokyo: Univ.\nAcademy Press), 2811\nHooper, D., & Dingus, B. 2002 [arXiv:astro-ph\/0212509]\nHooper, D., de la Calle Perez, I., Silk, J., Ferrer, F., & Sarkar, S. 2004\n[arXiv:astro-ph\/0404205]\nKosack, K., Badran, H. M., Bond, H. I., et al. 2004, ApJ, 608, L97\nLeroy, N., Bolz, O., Guy, J., et al. 2003, Proc. 28th ICRC, Tsukuba\n(Tokyo: Univ. Academy Press), 2895\nLevinson, A. 2000, Phys. Rev. Lett., 85, 912\nMaeda, Y., Baganoff, F. K., Feigelson, E. D., et al. 2002, ApJ, 570,\n671\nMarkoff, S., Melia, F., & Sarcevic, I. 1997, ApJ, 489, L47\nMayer-Hasselwander, H. A., Bertsch, D. L., Dingus, B. L., et al. 1998,\nA&A, 335, 161\nMelia, F. 1992, ApJ, 387, L25\nMelia, F., & Falcke, H. 2001, ARA&A, 39, 309\nMuno, M. P., Baganoff, F. K., Bautz, W. M., et al. 2003, ApJ, 589, 225\nNarayan, R., Mahadevan, R., Grindlay, J. E., Popham, R. G., &\nGammie, C. 1998, ApJ, 492, 554\nSch\u00f6del, R. R., Ott, T., Genzel, R., et al. 2002, Nature, 419, 694\nTsuchiya, K., Enomoto, R., Ksenofontov, L. T., et al. 2004, ApJ, 606,\nL115\nVincent, P., Denance, J.-P., Huppert, J.-F., et al. 2003, Proc. 28th\nICRC, Tsukuba (Tokyo: Univ. Academy Press), 2887\nYuan, F., Markoff, S., & Falcke, H. 2002, A&A, 383, 854\nYuan, F., Quataert, E., & Narayan, R. 2003, ApJ, 598, 301\nYusef-Zadeh, F., Melia, F., & Wardle, M. 2000, Science, 287, 85\nLe\ntte\nr\u00a0t\no\u00a0\nth\ne\u00a0\nEd\nito\nr\n"}